<?xml version="1.0" encoding="UTF-8"?>
<xs:schema xmlns:xs="http://www.w3.org/2001/XMLSchema">
    <xs:element name="biblioteca">
        <xs:complexType>
            <xs:sequence>
                <xs:element name="llibre" minOccurs="0" maxOccurs="unbounded">
                    <xs:complexType>
                        <xs:sequence>
                            <xs:element name="autor">
                                <xs:simpleType>
                                    <xs:restriction base="xs:string">
                                        <xs:maxLength value="50"/>
                                    </xs:restriction>
                                </xs:simpleType>
                            </xs:element>
                            <xs:element name="titol">
                                <xs:simpleType>
                                    <xs:restriction base="xs:string">
                                        <xs:maxLength value="50"/>
                                    </xs:restriction>
                                </xs:simpleType>
                            </xs:element>
                            <xs:element name="ISBN">
                                <xs:simpleType>
                                    <xs:restriction base="xs:string">
                                        <xs:pattern value="ISBN-[A-Z]{3}-[0-9]{8}"/>
                                    </xs:restriction>
                                </xs:simpleType>
                            </xs:element>
                            <xs:element name="stock" minOccurs="0">
                                <xs:simpleType>
                                    <xs:restriction base="xs:int">
                                        <xs:minInclusive value="1"/>
                                        <xs:maxInclusive value="999"/>
                                    </xs:restriction>
                                </xs:simpleType>
                            </xs:element>
                            <xs:element name="ubicacio">
                                <xs:simpleType>
                                    <xs:restriction base="xs:string">
                                        <xs:enumeration value="estanteria 1"/>
                                        <xs:enumeration value="estanteria 2"/>
                                        <xs:enumeration value="estanteria 3"/>
                                        <xs:enumeration value="estanteria 4"/>
                                        <xs:enumeration value="estanteria 5"/>
                                        <xs:enumeration value="estanteria 6"/>
                                        <xs:enumeration value="estanteria 7"/>
                                        <xs:enumeration value="estanteria 8"/>
                                        <xs:enumeration value="estanteria 9"/>
                                        <xs:enumeration value="estanteria 10"/>
                                    </xs:restriction>
                                </xs:simpleType>
                            </xs:element>
                            <xs:element name="comentaris" minOccurs="0">
                                <xs:complexType>
                                    <xs:sequence>
                                        <xs:element name="comentari" minOccurs="0" maxOccurs="unbounded">
                                            <xs:complexType>
                                                <xs:sequence>
                                                    <xs:element name="text" type="xs:string"/>
                                                    <xs:element name="usuari" type="xs:string"/>
                                                    <xs:element name="data_hora_publicacio" type="xs:dateTime"/>
                                                </xs:sequence>
                                            </xs:complexType>
                                        </xs:element>
                                    </xs:sequence>
                                </xs:complexType>
                            </xs:element>
                        </xs:sequence>
                        <xs:attribute name="codi" type="xs:positiveInteger" use="required"/>
                    </xs:complexType>
                </xs:element>
            </xs:sequence>
        </xs:complexType>
    </xs:element>
</xs:schema>